{
 "run_id": "2026-10-11-c1a15-product",
 "artifact": "evidence_pack",
 "version": "v1",
 "status": "superseded",
 "contents": [
  {
   "role": "evidence_pack",
   "path": "evidence-pack-v1.md",
   "sha256": "6d564400d187190fe0037edb6774607fe10e61fd39ce1e3a963b81fbe69e87f3"
  }
 ],
 "sources": [
  {
   "path": "context-packet.md",
   "reason": "G0 Context Packet v1 — Full Intent Context와 Task Evidence"
  },
  {
   "path": "source-manifest.json",
   "reason": "선택·제외 source 목록"
  },
  {
   "path": "sources/task/T01-user-guide-text.txt",
   "reason": "화면·흐름 기준(D1), 글자 추출본"
  },
  {
   "path": "sources/task/T02-manual_sections.json",
   "reason": "매뉴얼 절 구조·등급·소요 분"
  },
  {
   "path": "sources/task/T03-data-manifest.json",
   "reason": "데이터 출처·이력 분포"
  },
  {
   "path": "sources/task/T04-alarm_rules.json",
   "reason": "알람 경계·배치 규칙"
  },
  {
   "path": "sources/task/T05-eval-cards-README.md",
   "reason": "평가 카드 존재·작성 방식(정답 내용 제외)"
  },
  {
   "path": "sources/task/T06-architecture-text.txt",
   "reason": "구성 요소 연결(DB 표기는 D2로 대체), 글자 추출본"
  }
 ]
}