{
 "run_id": "2026-10-11-c1a15-product",
 "artifact": "context_packet",
 "version": "v1",
 "status": "critic_passed",
 "contents": [
  {
   "role": "context_packet",
   "path": "context-packet.md",
   "sha256": "a38deda9b25377d900c230819c9993ce40e9535b3113efe8e22dee06cd3e12d1"
  }
 ],
 "sources": [
  {
   "path": "/Users/insujo/Documents/repo/eval-ideal/session-run-v1.2/C1/submissions/C1-a15.md",
   "reason": "제품 의도·원칙·평가·장기 방향",
   "revision": "2026-10-06",
   "trust_boundary": "user/team document",
   "context_role": "intent",
   "content_mode": "full_document",
   "snapshot_path": "sources/intent/001.md",
   "content_sha256": "bbc8c6e0fef50986c824b34e8ed651478962432dda1ad2f74228818aecfde7a8"
  },
  {
   "path": "/Users/insujo/Documents/repo/c1a15-maint-guide/docs/spec/C1-a15-구현-명세.md",
   "reason": "사용자가 Wiki 대신 지정한 구현 명세(결정 D1~D19)",
   "revision": "v1.0 2026-10-11",
   "trust_boundary": "user/team document",
   "context_role": "intent",
   "content_mode": "full_document",
   "snapshot_path": "sources/intent/002.md",
   "content_sha256": "f969b0c259a6edcde4cadbbbfbf745b1046db3c72a34a82f2c5a1208f1f35ae6"
  },
  {
   "path": "/Users/insujo/Documents/repo/eval-ideal/packs/direction-v1.2/01-task-10-brief.md",
   "reason": "주최측 과제 10 원문",
   "revision": "2026-09-30",
   "trust_boundary": "organizer original",
   "context_role": "intent",
   "content_mode": "full_document",
   "snapshot_path": "sources/intent/003.md",
   "content_sha256": "33e16bc1b4b47d88801632cebf26fb671cca74ef8cf6c6639fe08d6e5d9ead1e"
  },
  {
   "id": "T01",
   "path": "/Users/insujo/Documents/repo/eval-ideal/docs/C1-a15-user-guide/정비길잡이-사용가이드.html",
   "reason": "화면·흐름 기준(D1), 글자 추출본",
   "context_role": "task_evidence",
   "content_mode": "reference_only",
   "snapshot_path": "sources/task/T01-user-guide-text.txt",
   "content_sha256": "ba5432ebdc070ff5017f7670ba2d17972b71cfff1a56f36ca2a4026f1a4fdd7b"
  },
  {
   "id": "T02",
   "path": "/Users/insujo/Documents/repo/c1a15-maint-guide/data/manuals/manual_sections.json",
   "reason": "매뉴얼 절 구조·등급·소요 분",
   "context_role": "task_evidence",
   "content_mode": "reference_only",
   "snapshot_path": "sources/task/T02-manual_sections.json",
   "content_sha256": "68d59f24ef86059ed6d6ef75a6d80343a27328a398825362c06bb66ac90ca598"
  },
  {
   "id": "T03",
   "path": "/Users/insujo/Documents/repo/c1a15-maint-guide/data/manifest.json",
   "reason": "데이터 출처·이력 분포",
   "context_role": "task_evidence",
   "content_mode": "reference_only",
   "snapshot_path": "sources/task/T03-data-manifest.json",
   "content_sha256": "7b36f4234634bee098f63ea099ea73c0f3d35de1bba7494b497ed8f2a1cdc10d"
  },
  {
   "id": "T04",
   "path": "/Users/insujo/Documents/repo/c1a15-maint-guide/data/alarm_rules.json",
   "reason": "알람 경계·배치 규칙",
   "context_role": "task_evidence",
   "content_mode": "reference_only",
   "snapshot_path": "sources/task/T04-alarm_rules.json",
   "content_sha256": "ef84d5b0317ed9de839c8b7b150bf5f58ce72764192fd9dfd54049dbf3865042"
  },
  {
   "id": "T05",
   "path": "/Users/insujo/Documents/repo/c1a15-maint-guide/eval/cards/README.md",
   "reason": "평가 카드 존재·작성 방식(정답 내용 제외)",
   "context_role": "task_evidence",
   "content_mode": "reference_only",
   "snapshot_path": "sources/task/T05-eval-cards-README.md",
   "content_sha256": "31b6110b58ef6a2c017dfe80b6f0a25ce709ebe89451b07229f3d9c152d13f10"
  },
  {
   "id": "T06",
   "path": "/Users/insujo/Documents/repo/c1a15-maint-guide/docs/architecture/시스템-아키텍처.html",
   "reason": "구성 요소 연결(DB 표기는 D2로 대체), 글자 추출본",
   "context_role": "task_evidence",
   "content_mode": "reference_only",
   "snapshot_path": "sources/task/T06-architecture-text.txt",
   "content_sha256": "0e39003fe9da03b755effdde3e77beb83e90e1b17faedbd77848567f701778ca"
  }
 ]
}